{
  "dataset": {
    "name": "format_messy_dataset",
    "file_name": "format_messy_dataset.csv",
    "file_type": "csv",
    "sheet_name": null
  },
  "status": "success",
  "schema_version": "0.3",
  "profile": {
    "row_count": 4,
    "column_count": 7,
    "columns": [
      {
        "name": "record_id",
        "missing_count": 0,
        "non_missing_count": 4,
        "missing_rate": 0.0,
        "inferred_type": "numeric",
        "non_null_samples": []
      },
      {
        "name": "service_name",
        "missing_count": 0,
        "non_missing_count": 4,
        "missing_rate": 0.0,
        "inferred_type": "text",
        "non_null_samples": []
      },
      {
        "name": "department",
        "missing_count": 0,
        "non_missing_count": 4,
        "missing_rate": 0.0,
        "inferred_type": "text",
        "non_null_samples": []
      },
      {
        "name": "update_time",
        "missing_count": 0,
        "non_missing_count": 4,
        "missing_rate": 0.0,
        "inferred_type": "text",
        "non_null_samples": []
      },
      {
        "name": "source_url",
        "missing_count": 0,
        "non_missing_count": 4,
        "missing_rate": 0.0,
        "inferred_type": "text",
        "non_null_samples": []
      },
      {
        "name": "version",
        "missing_count": 0,
        "non_missing_count": 4,
        "missing_rate": 0.0,
        "inferred_type": "text",
        "non_null_samples": []
      },
      {
        "name": "handling_days",
        "missing_count": 0,
        "non_missing_count": 4,
        "missing_rate": 0.0,
        "inferred_type": "text",
        "non_null_samples": []
      }
    ],
    "recognized_fields": {
      "date": [
        "update_time"
      ],
      "numeric": [
        "handling_days",
        "record_id"
      ],
      "url": [
        "source_url"
      ],
      "source": [
        "department",
        "source_url"
      ],
      "version": [
        "update_time",
        "version"
      ]
    },
    "warnings": []
  },
  "metrics": [
    {
      "id": "file_parse_rate",
      "name": "文件可解析率",
      "category": "可读取性",
      "status": "evaluated",
      "value": 1.0,
      "unit": "ratio",
      "scope": "dataset",
      "field": null,
      "evidence": {
        "attempted_file_count": 1,
        "successful_file_count": 1,
        "failed_file_count": 0
      },
      "reason": null,
      "metric_key": "metric:file_parse_rate:dataset"
    },
    {
      "id": "dataset_scale",
      "name": "数据规模",
      "category": "规模",
      "status": "evaluated",
      "value": 4,
      "unit": "records",
      "scope": "dataset",
      "field": null,
      "evidence": {
        "file_count": 1,
        "row_count": 4,
        "column_count": 7
      },
      "reason": null,
      "metric_key": "metric:dataset_scale:dataset"
    },
    {
      "id": "field_missing_rate",
      "name": "字段缺失率",
      "category": "完整性",
      "status": "evaluated",
      "value": 0.0,
      "unit": "ratio",
      "scope": "field",
      "field": "record_id",
      "evidence": {
        "checked_count": 4,
        "issue_count": 0
      },
      "reason": null,
      "metric_key": "metric:field_missing_rate:field:record_id"
    },
    {
      "id": "field_missing_rate",
      "name": "字段缺失率",
      "category": "完整性",
      "status": "evaluated",
      "value": 0.0,
      "unit": "ratio",
      "scope": "field",
      "field": "service_name",
      "evidence": {
        "checked_count": 4,
        "issue_count": 0
      },
      "reason": null,
      "metric_key": "metric:field_missing_rate:field:service_name"
    },
    {
      "id": "field_missing_rate",
      "name": "字段缺失率",
      "category": "完整性",
      "status": "evaluated",
      "value": 0.0,
      "unit": "ratio",
      "scope": "field",
      "field": "department",
      "evidence": {
        "checked_count": 4,
        "issue_count": 0
      },
      "reason": null,
      "metric_key": "metric:field_missing_rate:field:department"
    },
    {
      "id": "field_missing_rate",
      "name": "字段缺失率",
      "category": "完整性",
      "status": "evaluated",
      "value": 0.0,
      "unit": "ratio",
      "scope": "field",
      "field": "update_time",
      "evidence": {
        "checked_count": 4,
        "issue_count": 0
      },
      "reason": null,
      "metric_key": "metric:field_missing_rate:field:update_time"
    },
    {
      "id": "field_missing_rate",
      "name": "字段缺失率",
      "category": "完整性",
      "status": "evaluated",
      "value": 0.0,
      "unit": "ratio",
      "scope": "field",
      "field": "source_url",
      "evidence": {
        "checked_count": 4,
        "issue_count": 0
      },
      "reason": null,
      "metric_key": "metric:field_missing_rate:field:source_url"
    },
    {
      "id": "field_missing_rate",
      "name": "字段缺失率",
      "category": "完整性",
      "status": "evaluated",
      "value": 0.0,
      "unit": "ratio",
      "scope": "field",
      "field": "version",
      "evidence": {
        "checked_count": 4,
        "issue_count": 0
      },
      "reason": null,
      "metric_key": "metric:field_missing_rate:field:version"
    },
    {
      "id": "field_missing_rate",
      "name": "字段缺失率",
      "category": "完整性",
      "status": "evaluated",
      "value": 0.0,
      "unit": "ratio",
      "scope": "field",
      "field": "handling_days",
      "evidence": {
        "checked_count": 4,
        "issue_count": 0
      },
      "reason": null,
      "metric_key": "metric:field_missing_rate:field:handling_days"
    },
    {
      "id": "blank_record_rate",
      "name": "空白记录率",
      "category": "完整性",
      "status": "evaluated",
      "value": 0.0,
      "unit": "ratio",
      "scope": "dataset",
      "field": null,
      "evidence": {
        "checked_count": 4,
        "issue_count": 0,
        "method": "inferred_content_fields_blank",
        "content_fields": [
          "service_name",
          "department",
          "update_time",
          "source_url",
          "version",
          "handling_days"
        ]
      },
      "reason": null,
      "metric_key": "metric:blank_record_rate:dataset"
    },
    {
      "id": "field_type_consistency",
      "name": "字段类型一致率",
      "category": "类型一致性",
      "status": "evaluated",
      "value": 1.0,
      "unit": "ratio",
      "scope": "field",
      "field": "record_id",
      "evidence": {
        "checked_count": 4,
        "issue_count": 0,
        "dominant_type": "numeric",
        "type_counts": {
          "numeric": 4
        }
      },
      "reason": null,
      "metric_key": "metric:field_type_consistency:field:record_id"
    },
    {
      "id": "field_type_consistency",
      "name": "字段类型一致率",
      "category": "类型一致性",
      "status": "evaluated",
      "value": 1.0,
      "unit": "ratio",
      "scope": "field",
      "field": "service_name",
      "evidence": {
        "checked_count": 4,
        "issue_count": 0,
        "dominant_type": "text",
        "type_counts": {
          "text": 4
        }
      },
      "reason": null,
      "metric_key": "metric:field_type_consistency:field:service_name"
    },
    {
      "id": "field_type_consistency",
      "name": "字段类型一致率",
      "category": "类型一致性",
      "status": "evaluated",
      "value": 1.0,
      "unit": "ratio",
      "scope": "field",
      "field": "department",
      "evidence": {
        "checked_count": 4,
        "issue_count": 0,
        "dominant_type": "text",
        "type_counts": {
          "text": 4
        }
      },
      "reason": null,
      "metric_key": "metric:field_type_consistency:field:department"
    },
    {
      "id": "field_type_consistency",
      "name": "字段类型一致率",
      "category": "类型一致性",
      "status": "evaluated",
      "value": 0.75,
      "unit": "ratio",
      "scope": "field",
      "field": "update_time",
      "evidence": {
        "checked_count": 4,
        "issue_count": 1,
        "dominant_type": "datetime",
        "type_counts": {
          "datetime": 3,
          "text": 1
        }
      },
      "reason": null,
      "metric_key": "metric:field_type_consistency:field:update_time"
    },
    {
      "id": "field_type_consistency",
      "name": "字段类型一致率",
      "category": "类型一致性",
      "status": "evaluated",
      "value": 1.0,
      "unit": "ratio",
      "scope": "field",
      "field": "source_url",
      "evidence": {
        "checked_count": 4,
        "issue_count": 0,
        "dominant_type": "text",
        "type_counts": {
          "text": 4
        }
      },
      "reason": null,
      "metric_key": "metric:field_type_consistency:field:source_url"
    },
    {
      "id": "field_type_consistency",
      "name": "字段类型一致率",
      "category": "类型一致性",
      "status": "evaluated",
      "value": 1.0,
      "unit": "ratio",
      "scope": "field",
      "field": "version",
      "evidence": {
        "checked_count": 4,
        "issue_count": 0,
        "dominant_type": "text",
        "type_counts": {
          "text": 4
        }
      },
      "reason": null,
      "metric_key": "metric:field_type_consistency:field:version"
    },
    {
      "id": "field_type_consistency",
      "name": "字段类型一致率",
      "category": "类型一致性",
      "status": "evaluated",
      "value": 0.75,
      "unit": "ratio",
      "scope": "field",
      "field": "handling_days",
      "evidence": {
        "checked_count": 4,
        "issue_count": 1,
        "dominant_type": "numeric",
        "type_counts": {
          "numeric": 3,
          "text": 1
        }
      },
      "reason": null,
      "metric_key": "metric:field_type_consistency:field:handling_days"
    },
    {
      "id": "recognizable_format_anomaly_rate",
      "name": "可识别格式异常率",
      "category": "格式规范性",
      "status": "evaluated",
      "value": 0.25,
      "unit": "ratio",
      "scope": "field",
      "field": "update_time",
      "evidence": {
        "expected_format": "datetime",